A1: No. | B1: ツイート時刻 | C1: ツイート内容
A2: =ROW()-1 -> 1 | B2: 2023-01-07_17:15:25 | C2: @sekano_ 大学の先生が刺された事件もまだ捕まってませんもんね。茅ヶ崎のやつは自首で逮捕されましたが。治安面で間違いなく良くない。犯罪者に都合良すぎ。
A3: =ROW()-1 -> 2 | B3: 2023-01-06_20:21:10 | C3: @GTR34z34love 茅ヶ崎から結構圏央道使ってます。空いているときは走ってて気持ちいいけど八王子ジャンクションが渋滞するとトンネル内が灼熱、排ガス地獄となる。
A4: =ROW()-1 -> 3 | B4: 2023-01-06_16:03:55 | C4: 防災無線で新学期が始まるから、地域で見守りしてと。茅ヶ崎市。こんな放送今までなかったけど、なぜに？→治安が悪くなってる？市民にお願いすればタダで使える？
A5: =ROW()-1 -> 4 | B5: 2023-01-04_20:35:43 | C5: 確かに新湘南バイパスは高いです……最初から請求するくらいなら分割せずに410円請求するか通行券方式で藤沢出口でまとめて請求かどっちかにしてほしいです。どうせ降りれないんで強制的に茅ヶ崎JCT超えたら310円取られるんで……100円だと思ってたら初見殺しでした
A6: =ROW()-1 -> 5 | B6: 2023-01-04_17:01:28 | C6: 茅ヶ崎のドライバーは、マナーが悪い。交差点で左折車両の前に右折車両が出ようとする。危ないから状況により譲るが危険極まりない。これは、女性ドライバーが多い。先程、一号線を制限速度で走っていたら、クラクションを鳴らされた。パッシン… https://t.co/oJubsPT41K
A7: =ROW()-1 -> 6 | B7: 2023-01-04_01:51:27 | C7: 寒川はとりあえず海を用意しろ鎌倉は鎌倉でいいだろ茅ヶ崎は許すが以西は湘西だろ（過激派
A8: =ROW()-1 -> 7 | B8: 2023-01-03_23:09:54 | C8: たでま。15時に木更津でアクアライン渋滞に飛び込んで海ほたるで1時間ほど散歩、茅ヶ崎経由で帰ってきたら8時間経過している…( 'ω')
A9: =ROW()-1 -> 8 | B9: 2023-01-03_15:07:04 | C9: @nepoc_channel 茅ヶ崎の山側を走ってますが、国１との合流する道路の交差点手前から詰まって渋滞になってしまいますね🤔
A10: =ROW()-1 -> 9 | B10: 2023-01-03_11:41:22 | C10: 圏央道の茅ヶ崎から出て藤沢バイパス→横浜新道と走ると渋滞地獄だった記憶が…そろそろ工事が終わって快適になってるといいけど#箱根駅伝
A11: =ROW()-1 -> 10 | B11: 2023-01-03_10:56:07 | C11: 現在(10:56)、首都圏の渋滞情報(3/6)です。・高速湾岸線 東行 川崎航路トンネル付近-混雑:1km ・館山道 下り 富津竹岡ＩＣ付近-渋滞+混雑3km ・新湘南バイパス 下り 茅ヶ崎西ＩＣ付近-渋滞:1km ・圏央… https://t.co/eYjzehPBSz
A12: =ROW()-1 -> 11 | B12: 2023-01-03_09:56:07 | C12: 現在(09:56)、首都圏の渋滞情報(1/2)です。・３号渋谷線 下り 三軒茶屋付近-混雑:1km ・新湘南バイパス 下り 茅ヶ崎西ＩＣ付近-渋滞:1km ・圏央道 内回 海老名ＪＣＴ付近-渋滞:2km ・関越道 下り 水… https://t.co/qOJNCTDdKB
A13: =ROW()-1 -> 12 | B13: 2023-01-02_17:53:47 | C13: @Epicurean_Taro 12月と1月で茅ヶ崎市PayPayの対象店舗変わりますかね！？✨12月は飲食が多かったですが既に選び放題で充実してました😆藤沢市も頑張ってほしいな〜（主に日用品😂）
A14: =ROW()-1 -> 13 | B14: 2022-12-30_11:56:07 | C14: 現在(11:56)、首都圏の渋滞情報(4/9)です。・高速湾岸線 西行 千鳥町付近-渋滞:1km 川崎浮島ＪＣＴ付近-渋滞+混雑3km ・小田原厚木道路 下り 小田原西ＩＣ付近-渋滞:1km ・新湘南バイパス 下り 茅ヶ崎… https://t.co/MUrQ6uujUC
A15: =ROW()-1 -> 14 | B15: 2022-12-30_09:56:08 | C15: 現在(09:56)、首都圏の渋滞情報(3/6)です。・小田原厚木道路 下り 小田原料金所付近-渋滞:3km ・新湘南バイパス 下り 茅ヶ崎海岸ＩＣ付近-渋滞:1km ・東京湾アクアライン 下り アクアトンネル付近-渋滞:1k… https://t.co/znGYrY8oX3
A16: =ROW()-1 -> 15 | B16: 2022-12-30_08:56:08 | C16: 現在(08:56)、首都圏の渋滞情報(2/5)です。・小田原厚木道路 下り 小田原料金所付近-渋滞:3km ・新湘南バイパス 下り 茅ヶ崎海岸ＩＣ付近-渋滞:1km ・西湘バイパス 下り 小田原ブルーウェイブリッジ付近-渋滞… https://t.co/Zx1oGv9N3U