A1: No. | B1: ツイート時刻 | C1: ツイート内容
A2: =ROW()-1 -> 1 | B2: 2023-01-07_22:00:39 | C2: 今日の藤沢治安わるい:(´◦ω◦｀):
A3: =ROW()-1 -> 2 | B3: 2023-01-07_10:55:12 | C3: 平塚ららぽーとは駅から遠い（駅から1キロ、バスは有料）周辺道路の渋滞悪化圏央道寒川南から4キロくらいある、帰りは渋滞辻堂テラモが都内から近くアクティー廃止で利便性向上ららぽーとにタワレコあればなぁ
A4: =ROW()-1 -> 3 | B4: 2023-01-06_18:54:37 | C4: 気持ちめっちゃわかるけど、それなら江ノ島線を全線高架化してほしい（）相模大野のオーバーパスと大和と藤沢のオーバーパスと全部レベル揃えて踏切無くなるから、そしたら全駅10両対応して輸送力大増強w
A5: =ROW()-1 -> 4 | B5: 2023-01-06_17:56:08 | C5: 現在(17:56)、首都圏の渋滞情報(7/10)です。・Ｋ３号狩場線 下り 狩場ＩＣ付近-渋滞:1km ・湾岸分岐線 西行 昭和島ＪＣＴ付近-渋滞:1km ・東京外環道 内回 川口東ＩＣ付近-渋滞:11km ・新湘南バイパ… https://t.co/hyUeAAqAxB
A6: =ROW()-1 -> 5 | B6: 2023-01-05_15:58:13 | C6: @tomonathe 横浜新道から藤沢バイパスにかけてが一番渋滞するから、それのバイパスになるのありがたいっス。鎌倉は、どうせR134が混むから関係ないし、これができても湾岸線から横横通っていく分にはかわんないしね。
A7: =ROW()-1 -> 6 | B7: 2023-01-05_10:37:20 | C7: それより田中笠窪線の伊勢原市役所側の接続は本当にあれで良かったのだろうか？もうちょっと頑張って市役所前に接続すれば良かったものの、あれでは伊勢原藤沢線の交差点が増えて新たな渋滞スポットになるのでは？
A8: =ROW()-1 -> 7 | B8: 2023-01-05_02:23:09 | C8: ロマンスカーの本数も減っているんですね。不便ですね。小田急線も藤沢で1回乗り換えないといけないのが面倒です以前のように片瀬江ノ島までの直通電車を出してほしいなと思います。
A9: =ROW()-1 -> 8 | B9: 2023-01-04_20:35:43 | C9: 確かに新湘南バイパスは高いです……最初から請求するくらいなら分割せずに410円請求するか通行券方式で藤沢出口でまとめて請求かどっちかにしてほしいです。どうせ降りれないんで強制的に茅ヶ崎JCT超えたら310円取られるんで……100円だと思ってたら初見殺しでした
A10: =ROW()-1 -> 9 | B10: 2023-01-04_19:01:08 | C10: slam dunkで有名な踏切江ノ島からこの辺りまでは今日も渋滞でした🚴‍♂️
A11: =ROW()-1 -> 10 | B11: 2023-01-04_14:56:06 | C11: 現在(14:56)、首都圏の渋滞情報(2/3)です。・Ｋ１号横羽線 上り 汐入付近-混雑:1km ・新湘南バイパス 上り 藤沢ＩＣ付近-渋滞:1km ・東名 上り 大和ＴＮ付近-渋滞:11km 伊勢原ＪＣＴ付近-渋滞:8k… https://t.co/qYEnziRfd0
A12: =ROW()-1 -> 11 | B12: 2023-01-04_09:42:44 | C12: 国道1号線の藤沢〜戸塚間の日曜の渋滞に捕まったときに「今日これ何かイベントでもあるんですか？」って聞かれるくらいに渋滞は深刻なエリアだからねえ。開通すれば保土ヶ谷バイパスへの流入も減りそうね。
A13: =ROW()-1 -> 12 | B13: 2023-01-03_16:23:27 | C13: 江ノ島の橋の渋滞すごいな。人もすごいけど
A14: =ROW()-1 -> 13 | B14: 2023-01-03_16:14:31 | C14: テラスモール湘南出口渋滞エグい🥺
A15: =ROW()-1 -> 14 | B15: 2023-01-03_15:11:59 | C15: 辻堂駅周辺のテラスモール湘南家族サービスファミリー渋滞も追加で。。。
A16: =ROW()-1 -> 15 | B16: 2023-01-03_11:41:22 | C16: 圏央道の茅ヶ崎から出て藤沢バイパス→横浜新道と走ると渋滞地獄だった記憶が…そろそろ工事が終わって快適になってるといいけど#箱根駅伝
A17: =ROW()-1 -> 16 | B17: 2023-01-02_17:56:07 | C17: 現在(17:56)、首都圏の渋滞情報(5/11)です。・東京外環道 内回 川口東ＩＣ付近-渋滞:10km 外回 草加ＩＣ付近-渋滞:4km ・小田原厚木道路 上り 厚木ＩＣ付近-渋滞:1km ・新湘南バイパス 上り 藤沢Ｉ… https://t.co/vsM22MXoZ9
A18: =ROW()-1 -> 17 | B18: 2023-01-02_17:53:47 | C18: @Epicurean_Taro 12月と1月で茅ヶ崎市PayPayの対象店舗変わりますかね！？✨12月は飲食が多かったですが既に選び放題で充実してました😆藤沢市も頑張ってほしいな〜（主に日用品😂）
A19: =ROW()-1 -> 18 | B19: 2023-01-02_16:56:08 | C19: 現在(16:56)、首都圏の渋滞情報(6/14)です。・東京外環道 内回 草加ＩＣ付近-渋滞:4km 外環三郷西ＩＣ付近-渋滞:3km 外回 草加ＩＣ付近-渋滞:5km ・小田原厚木道路 上り 厚木ＩＣ付近-渋滞:2km… https://t.co/wzVsZFMlJM
A20: =ROW()-1 -> 19 | B20: 2023-01-02_16:46:15 | C20: 鎌倉に向かったはいいものの、交通規制と渋滞が酷そうなので、藤沢で車を止めて電車にスイッチ。まっすぐ江ノ電でも良かったんだけど、ちょっと小田急に乗りたい気分だったんだ…
A21: =ROW()-1 -> 20 | B21: 2023-01-02_15:56:08 | C21: 現在(15:56)、首都圏の渋滞情報(6/13)です。・東京外環道 内回 外環三郷西ＩＣ付近-渋滞:1km 外回 川口東ＩＣ付近-渋滞:3km ・小田原厚木道路 上り 厚木ＩＣ付近-渋滞:1km ・新湘南バイパス 上り 藤… https://t.co/OmajdrAxnX
A22: =ROW()-1 -> 21 | B22: 2023-01-02_14:56:08 | C22: 現在(14:56)、首都圏の渋滞情報(6/12)です。・新湘南バイパス 上り 藤沢ＩＣ付近-渋滞:1km ・圏央道 内回 狭山ＰＡ付近-渋滞:3km 狭山日高ＩＣ付近-渋滞:4km 外回 日の出ＩＣ付近-渋滞:2km 海… https://t.co/RScXfA0r5B
A23: =ROW()-1 -> 22 | B23: 2023-01-02_11:14:52 | C23: @white99noise @Thomaskeiba 伊勢佐木町とはこれまた凄い所に住んどりましたね😁藤沢は大変良い所だと思いますが駅周りの🚙渋滞が😅
A24: =ROW()-1 -> 23 | B24: 2023-01-01_14:43:22 | C24: 何となく江ノ島来てみたけど意味わからん外人が騒ぎまくっててクソ治安悪いの草生える
A25: =ROW()-1 -> 24 | B25: 2023-01-01_14:42:30 | C25: 江ノ島の治安が安定
A26: =ROW()-1 -> 25 | B26: 2023-01-01_14:40:38 | C26: 正月の江ノ島治安悪すぎ
A27: =ROW()-1 -> 26 | B27: 2023-01-01_14:08:11 | C27: 江ノ島神社いかないと行けないのかなぁ。神様にいつよばれるか？原宿みたいに混んでるからあまりいきたくない。みんなうるさいし写真とるし。あの中だけでも撮影禁止にしてほしいな。神様おこってるよ。
A28: =ROW()-1 -> 27 | B28: 2023-01-01_14:05:11 | C28: 藤沢のロイヤル、年末年始で営業してるやんけ！！！って喜んでグーグルマップの渋滞情報みたら、周辺真っ赤になってた
A29: =ROW()-1 -> 28 | B29: 2023-01-01_13:04:13 | C29: ちなみに行きは江ノ島周辺初詣勢の渋滞にハマりました。諦めて高速乗ろうとしたら初詣交通規制で近くの高速は乗れませんでした(逗子インターまでお戻り)
A30: =ROW()-1 -> 29 | B30: 2023-01-01_12:28:36 | C30: 江ノ島に橋をかける必要はあったのだろうか。今を昔になすよしもがな。
A31: =ROW()-1 -> 30 | B31: 2023-01-01_04:44:12 | C31: 江ノ島来たけどなかなか治安終わってます
A32: =ROW()-1 -> 31 | B32: 2022-12-31_22:13:29 | C32: これから500年後の神奈川県の湘南地域沿岸部は水没し、海上で船で生活する市民と上級国民は海底都市で生活するコロニーが出来ます。江ノ島は唯一先端の岩をポコッと出し軍事拠点になってるそんな夢を最近見た海上都市はとても治安悪く、他人種がほぼ市民の7割、貧困だけど楽しい街
A33: =ROW()-1 -> 32 | B33: 2022-12-30_21:06:01 | C33: 神奈川県治安悪さランキング1位川崎2位平塚3位厚木4位横浜5位伊勢原6位藤沢
A34: =ROW()-1 -> 33 | B34: 2022-12-30_17:56:07 | C34: 現在(17:56)、首都圏の渋滞情報(4/6)です。・小田原厚木道路 上り 厚木ＩＣ付近-渋滞:1km ・新湘南バイパス 上り 藤沢ＩＣ付近-渋滞:1km ・中央道 上り 小仏ＴＮ付近-渋滞:15km ・圏央道 外回 海老… https://t.co/pdbdpFmdNm
A35: =ROW()-1 -> 34 | B35: 2022-12-30_00:13:46 | C35: 藤沢治安悪くてふるえる
A36: =ROW()-1 -> 35 | B36: 2022-12-29_17:56:07 | C36: 現在(17:56)、首都圏の渋滞情報(3/6)です。・新東名 上り 海老名南ＪＣＴ付近-渋滞+混雑2km ・小田原厚木道路 上り 厚木ＩＣ付近-渋滞:1km ・新湘南バイパス 上り 藤沢ＩＣ付近-渋滞:1km #新東名 #小田原厚木道路 #新湘南バイパス