A1: No. | B1: ツイート時刻 | C1: ツイート内容
A2: =ROW()-1 -> 1 | B2: 2023-01-07_03:17:41 | C2: なお、箱根や江ノ島も最悪の状況らしい。転んで骨折しても事故にあっても救急車来ないから。来ても病院ない。発熱しても受け入れない。命が大事なら神奈川来るな…マジで…
A3: =ROW()-1 -> 2 | B3: 2023-01-06_09:25:56 | C3: @403403403_ もう神奈川だと治安の悪さはお国自慢みたいになりがちだもの箱根と小田原くらいじゃないかな治安の悪さで勝負に来ないの
A4: =ROW()-1 -> 3 | B4: 2023-01-04_16:44:25 | C4: @iphoto014 お疲れ様🤗こちらは箱根新道で渋滞に巻き込まれております😓
A5: =ROW()-1 -> 4 | B5: 2023-01-04_14:51:00 | C5: @livedoornews 開催そのものには反対しないが、全国化には反対。今まででもバス時刻変更とか様々な迷惑をかけてるのに、それが全国に広がるなんて・・・。他地域から「迷惑の輸出はするな」って言われそう。箱根だけでやってほしい。正月2日だけ我慢するから。
A6: =ROW()-1 -> 5 | B6: 2023-01-04_13:35:35 | C6: @YahooNewsTopics 関東学生陸上競技連盟のを離れるなら邪魔だから他所でやってほしいね全国化して人気になるなら箱根ブランドで食う必要ないよね
A7: =ROW()-1 -> 6 | B7: 2023-01-04_13:33:07 | C7: @YahooNewsTopics 箱根にこだわらんでいいとこ探して走って欲しいな。毎年神奈川の国道潰して大渋滞起きてるってのも忘れんでほしい…
A8: =ROW()-1 -> 7 | B8: 2023-01-04_12:48:31 | C8: @Rei1xx 大涌谷方面はちょっとわかりませんが、箱根神社とか芦ノ湖あたり全然車動く気配ないくらい渋滞してました😅自分も駒ヶ岳行く予定でしたが断念して十国峠向かってます✨
A9: =ROW()-1 -> 8 | B9: 2023-01-04_10:55:19 | C9: 都内も東名も小田厚もガラガラだったのに箱根の駐車場渋滞に巻き込まれてだいぶロス
A10: =ROW()-1 -> 9 | B10: 2023-01-04_09:17:21 | C10: 箱根神社付近この時間から渋滞してるのね
A11: =ROW()-1 -> 10 | B11: 2023-01-03_23:58:40 | C11: 東名の工事長いし、絶対渋滞するな🚗🚗🚗³₃😭冬の箱根怖いんだけど😱
A12: =ROW()-1 -> 11 | B12: 2023-01-03_19:14:56 | C12: 東名の渋滞減ってきてはいるけどまだ11kmとかだし、国１じゃ箱根の凍結怖いし……r11で熱海経由かなぁ
A13: =ROW()-1 -> 12 | B13: 2023-01-03_17:07:33 | C13: あと、箱根登山に関しては並行する国道1号が渋滞しがちで、渋滞時に限っては車やバスよりも電車の方が所要時間的に勝ってしまうというのがあるので一応電車が出る幕はある。宮ノ下あたりで渋滞予告されてバスを乗り捨てて電車に移ったことがある人も少なくないかと。