A1: No. | B1: ツイート時刻 | C1: ツイート内容
A2: =ROW()-1 -> 1 | B2: 2023-01-03_13:04:46 | C2: 国道134逗子方面鎌倉駅入口まで渋滞です。😓反対車線順調
A3: =ROW()-1 -> 2 | B3: 2023-01-03_11:02:26 | C3: @mi_suikyou そういうルート！小田原が新幹線駅である利点！からの東海道線。鎌倉からの江ノ島！だから昼過ぎから夕方に江ノ島近辺が渋滞するのか！納得です。
A4: =ROW()-1 -> 3 | B4: 2023-01-03_00:40:08 | C4: 鎌倉市のホームページにはそもそもフリースクールの情報はないし学校からも教えられないと聞く。お隣の藤沢市のホームページを見てみるとまずN高から始まり、東京の学校、鎌倉市など近隣市の学校もたくさん掲載されている。こどもが学校行かなく… https://t.co/viYtnkf5fF
A5: =ROW()-1 -> 4 | B5: 2023-01-03_00:23:15 | C5: 本来であれば◎とか◯とかつくはずであるマスに「／」がついた児童の気持ちは？（そもそも通知表不要論だけど）なーにが義務教育じゃい、それなら教育を学びの場を与えてほしい、「全ての」こどもに。鎌倉市、めちゃくちゃ「多数を取り残してる」よ。SDGsのゴール達成はほど遠い…😢
A6: =ROW()-1 -> 5 | B6: 2023-01-03_00:15:01 | C6: されるのが辛いところ。おそらくその形の「解消」は多いのだろうな。不登校率の高い鎌倉市、そろそろ「不登校」問題の解消に腰を上げてほしい…🥺ちなみに議会では毎回多数の議員が質疑しているのだが、教育委員会からは政教分離、とか言われる感じでバリアがすごいのだ。
A7: =ROW()-1 -> 6 | B7: 2023-01-01_22:00:18 | C7: @Nori_suke55 134号線は凄い渋滞でしたが、長谷通りは、バスや許可車だけしか走っていなかったので空いていました。早朝7時半から2時間弱の外出でしたが。鎌倉駅周辺や八幡宮は混んだのではないでしょうか？
A8: =ROW()-1 -> 7 | B8: 2023-01-01_09:34:59 | C8: @ritsukaPya 正しい使い方をしてほしいですよね。鎌倉市では過去に「徘徊老人」の情報を流し、その後「おわび」のエリアメールも流しました。どちらも違反。
A9: =ROW()-1 -> 8 | B9: 2023-01-01_08:47:08 | C9: 鶴岡八幡宮組、治安が全体的に悪い。
A10: =ROW()-1 -> 9 | B10: 2022-12-31_23:59:33 | C10: NHK鶴岡八幡宮～～～マスク注意しろよ・・・感染拡大まったなし
A11: =ROW()-1 -> 10 | B11: 2022-12-30_18:07:01 | C11: @gabuno_geboku 鎌倉っていうと皆さんいいところだね～って言ってくれるんですが、今となっては住むところじゃなくて観光地だったなーと思います……田舎すぎて交通の便は悪いし渋滞すごいし😂横浜駅自体は一応完成したかなあ… https://t.co/SmWj5eOLRN
A12: =ROW()-1 -> 11 | B12: 2022-12-30_11:13:51 | C12: 鎌倉霊園から鎌倉駅に向かう道、渋滞なう。嫌だ。
A13: =ROW()-1 -> 12 | B13: 2022-12-28_09:44:34 | C13: @pi_______z 鎌倉高校前付近で海に見とれて事故でも起こしたら完全アウト！大渋滞ですね💦この前は茅ヶ崎方面まで渋滞していて134の平塚から鎌倉の鶴岡八幡宮まで4時間かかりました🥲
A14: =ROW()-1 -> 13 | B14: 2022-12-27_23:33:44 | C14: @nagasi 稲村の海岸が無いです、養浜事業を県土木事務所が計画してくれています。津波対策は鎌倉市ですがそちらは今一進んでません、海岸は市の縦割りで進みが凄く悪い様です😂