A1: No. | B1: ツイート時刻 | C1: ツイート内容
A2: =ROW()-1 -> 1 | B2: 2023-01-06_21:25:28 | C2: 住んだことはないけれど、川崎民は蒲田は治安が悪いと言い、蒲田民は川崎は治安が悪いとよく言っているイメージ
A3: =ROW()-1 -> 2 | B3: 2023-01-06_21:10:41 | C3: 川崎に住んでる時嫌な思いすることなんてほとんどなかったのにここ数年最悪
A4: =ROW()-1 -> 3 | B4: 2023-01-06_19:37:38 | C4: 基本、川崎のファーストフードには質の悪い人間しか来ない。
A5: =ROW()-1 -> 4 | B5: 2023-01-06_19:32:18 | C5: @1981_0121 このアクセス問題、永遠の課題です！地元の人とかは抜け道よく知ってるから大丈夫ですけど、慣れない人からするとひたすら渋滞ですし。うちもスンテさんいますし、今年こそ川崎に勝ちます🔥
A6: =ROW()-1 -> 5 | B6: 2023-01-06_18:08:14 | C6: @hina58088705 反マスクが💩なんですよまあ川崎の治安が悪いのは否定しないですが
A7: =ROW()-1 -> 6 | B7: 2023-01-06_15:57:31 | C7: 神奈川県の相談窓口にも川崎市の相談窓口にもいろんな医療機関にも電話してわかった結論。コロナにかかった自分が悪い。誰も助けてはくれない。リスクがあっても薬すら手に入らない。医療のスタートにすら立てない。＃新型コロナ＃陽性
A8: =ROW()-1 -> 7 | B8: 2023-01-06_15:50:33 | C8: 正直いつてあれ以来川崎の価値は総じて落ちていますよ特に条例の運動がはじまった川崎区あたりは物凄い評判が悪い地区になりましただってそんなところに住みたいと思いますか？多分当の外国人も住みたいと思わないでしょうよ
A9: =ROW()-1 -> 8 | B9: 2023-01-06_15:05:59 | C9: 川崎？あーあの治安悪いところねｗこれ言われるとむかつく！
A10: =ROW()-1 -> 9 | B10: 2023-01-06_12:47:09 | C10: 川崎駅エリアは駐禁アンド渋滞怖い
A11: =ROW()-1 -> 10 | B11: 2023-01-06_11:51:22 | C11: 川崎のyoutubeLiveなんでこんなに回線悪いのｗｗｗｗ3Gで放送してんの？ｗｗｗｗ
A12: =ROW()-1 -> 11 | B12: 2023-01-06_11:19:58 | C12: @nekohuhuhu 都知事！今こそ腕の見せ所だ！！！やれ！！！川崎に109くれ！！
A13: =ROW()-1 -> 12 | B13: 2023-01-06_05:26:08 | C13: 2年ほど前になるのか、NHKの22時ぐらいの番組で、この神奈川県川崎市を取り上げていたのですが、どういう言葉が使われていたのか思い出せないのですが、要するに治安が悪いような話もあったかと記憶しています。
A14: =ROW()-1 -> 13 | B14: 2023-01-06_02:56:08 | C14: 現在(02:56)、首都圏の渋滞情報です。・高速湾岸線 東行 東扇島付近-渋滞:1km 鶴見つばさ橋付近-渋滞:1km 川崎航路トンネル付近-混雑:1km #高速湾岸線
A15: =ROW()-1 -> 14 | B15: 2023-01-05_23:21:00 | C15: @Tibetora_GANG 川崎ただでさえ治安悪いんで気をつけましょうね！！！()
A16: =ROW()-1 -> 15 | B16: 2023-01-05_23:18:35 | C16: @014xx1 横浜らへんはやめとき治安クソ悪い川崎も
A17: =ROW()-1 -> 16 | B17: 2023-01-05_21:56:07 | C17: 現在(21:56)、首都圏の渋滞情報です。・３号渋谷線 下り 三軒茶屋付近-混雑:1km ・６号向島線 下り 両国ＪＣＴ付近-混雑:1km ・高速湾岸線 東行 川崎浮島ＪＣＴ付近-渋滞:1km 西行 東扇島付近-混雑:1km #３号渋谷線 #６号向島線 #高速湾岸線
A18: =ROW()-1 -> 17 | B18: 2023-01-05_17:48:40 | C18: 神奈川県警がひどいとか川崎が治安悪いとかイメージでしかないよなぁ
A19: =ROW()-1 -> 18 | B19: 2023-01-05_15:05:59 | C19: 川崎？あーあの治安悪いところねｗこれ言われるとむかつく！
A20: =ROW()-1 -> 19 | B20: 2023-01-05_12:00:02 | C20: 川崎市子どもの権利に関する条例 前文 12/13 私たちは，子ども最優先などの国際的な原則も踏まえ，それぞれの子どもが一人の人間として生きていく上で必要な権利が保障されるよう努める。 #津 #三重 #こども #権利 #条例
A21: =ROW()-1 -> 20 | B21: 2023-01-05_11:40:15 | C21: @IshiharaNobu 駅に商業施設ってそんなに必要なのかな？ってとこから考え直すべきなのでは？川崎駅が変わって女性が買い物しやすくなったんだから鶴見でわざわざ服買ったりしないのでは？防音しっかりしてマンションでも良かったのでは？
A22: =ROW()-1 -> 21 | B22: 2023-01-05_04:56:07 | C22: 現在(04:56)、首都圏の渋滞情報です。・高速湾岸線 東行 川崎航路トンネル付近-渋滞:1km #高速湾岸線
A23: =ROW()-1 -> 22 | B23: 2023-01-05_02:56:07 | C23: 現在(02:56)、首都圏の渋滞情報です。・高速湾岸線 東行 川崎浮島ＪＣＴ付近-渋滞:1km 川崎航路トンネル付近-渋滞:1km 西行 多摩川トンネル付近-渋滞:1km ・Ｋ１号横羽線 下り 石川町ＪＣＴ付近-渋滞:1km #高速湾岸線 #Ｋ１号横羽線
A24: =ROW()-1 -> 23 | B24: 2023-01-04_23:56:07 | C24: 現在(23:56)、首都圏の渋滞情報です。・９号深川線 上り 枝川付近-渋滞:1km ・高速湾岸線 東行 川崎航路トンネル付近-渋滞:1km ・Ｋ１号横羽線 上り 横浜駅東口付近-渋滞:1km ・東名 上り 御殿場ＩＣ付近… https://t.co/MZu59edJ6x
A25: =ROW()-1 -> 24 | B25: 2023-01-04_16:44:08 | C25: また、歩きタバコと自転車の右側走行にあった。帰省先の名古屋から戻ってきて、川崎の治安の悪さがよく分かった気がする。ルールを守らせようとしない、怠慢な神奈川県警が原因じゃないかとも思う。『こちらも他の案件で忙しいので‥』もっと、活発に検挙摘発して、ルール守らない奴消えてほしい。
A26: =ROW()-1 -> 25 | B26: 2023-01-04_16:22:50 | C26: 町田と神奈川（川崎市麻生区、横浜市青葉区、相模原市、その他）は距離も経済圏も密接に関わっている為連携が必要です。南多摩地域でも維新！
A27: =ROW()-1 -> 26 | B27: 2023-01-04_15:29:16 | C27: @okosentabetai 横浜市と川崎市は悪い意味で切磋琢磨してるね！
A28: =ROW()-1 -> 27 | B28: 2023-01-04_12:56:07 | C28: 現在(12:56)、首都圏の渋滞情報(1/3)です。・３号渋谷線 上り 大橋ＪＣＴ付近-混雑:1km ・６号向島線 下り 両国ＪＣＴ付近-混雑:1km ・高速湾岸線 西行 千鳥町付近-渋滞:1km ・Ｋ６号川崎線 下り 殿… https://t.co/fwB6dJNRHp
A29: =ROW()-1 -> 28 | B29: 2023-01-04_10:18:31 | C29: @S_Last_Samurai 川崎は独特ですね在日コリアンが多い政府がしっかり対処してほしい
A30: =ROW()-1 -> 29 | B30: 2023-01-04_05:56:07 | C30: 現在(05:56)、首都圏の渋滞情報です。・Ｋ６号川崎線 下り 川崎浮島ＪＣＴ付近-渋滞:1km #Ｋ６号川崎線
A31: =ROW()-1 -> 30 | B31: 2023-01-04_00:28:50 | C31: @KklHX8K71M32CtO 本当に治安悪いよ川崎市だけで毎秒10人は死んでる
A32: =ROW()-1 -> 31 | B32: 2023-01-03_22:20:10 | C32: 妹が神奈川の治安の悪いで有名な川崎市に住んでるんだが、妹が「マジで治安悪い」って言ってるのに母親が「隣が二子玉川で近いのにそんなわけない」って言ってて笑ってしまったwww治安が悪いで有名な上に住んでる本人が治安悪いって言ってるの… https://t.co/86KR86Mh7r
A33: =ROW()-1 -> 32 | B33: 2023-01-03_21:43:07 | C33: 上がりました。私達は「全ての人に対して差別的言動はあってはならない」「罰則によって市民が監視される」川崎市の駅前での監視する座り込みが行われる事は避けたいものです。条例などで規制が必要なほど相模原市で差別が日常化しているとは考… https://t.co/l1k9cf0Q0Q
A34: =ROW()-1 -> 33 | B34: 2023-01-03_18:09:04 | C34: @karacoin03 横浜、川崎など、神奈川の所得制限世帯は引っ越したほうがいいのは同意なんですが、家買ってるとか通勤利便性で引っ越しはホント難易度高いんだろうと思います。。。。自治体ガチャはある程度ケリをつけてほしいところではありますね。。
A35: =ROW()-1 -> 34 | B35: 2023-01-03_17:52:57 | C35: @morinagalemonad 川崎方面の車線が川崎側の出口での故障車起因による渋滞で川崎から木更津まで完全に埋まっちゃってたみたいですそれで通行止に
A36: =ROW()-1 -> 35 | B36: 2023-01-03_17:23:50 | C36: この時間は東京湾アクアライン、川崎浮島方面の渋滞で高速バスとかも遅れるんですよね…渋滞嫌だなと思ったら、千葉県側でもう少し遊ぶか、食事をするか、お風呂に入って時間をずらすのも作戦かもしれないですよ。 #スカロケ
A37: =ROW()-1 -> 36 | B37: 2023-01-03_16:56:07 | C37: 現在(16:56)、首都圏の渋滞情報(4/10)です。・高速湾岸線 東行 川崎航路トンネル付近-渋滞:1km 大井南付近-混雑:1km 東海ＪＣＴ付近-混雑:2km ・東京外環道 内回 川口西ＩＣ付近-渋滞:4km ・圏… https://t.co/ucAijVVlM1
A38: =ROW()-1 -> 37 | B38: 2023-01-03_12:33:24 | C38: いま一瞬映った川崎のハロワ、ハロワに行く前にそれなりに怖いお兄さんたちに仕事探してんの？いいのあるよーてスカウト受けるからいっつも、失業保険ほしいから無理じゃんーて流してたけど治安悪いんよなーて思うねマシになったけどな