A1: No. | B1: ツイート時刻 | C1: ツイート内容
A2: =ROW()-1 -> 1 | B2: 2023-01-05_22:48:10 | C2: 宮ヶ瀬湖で想像する道がヤビツ峠だったのだけれど、よく考えたらあそこ通る必要性って全くないんですよね
A3: =ROW()-1 -> 2 | B3: 2023-01-03_08:39:35 | C3: カブ125乗ってる夢だった。んで逆走で路肩を走る、前カウルだけバイクのチャリ集団がいて「ここが宮ヶ瀬かぁ、治安悪いな」と思ってた。
A4: =ROW()-1 -> 3 | B4: 2023-01-02_22:52:17 | C4: あんま宮ヶ瀬行かないんですよ…無駄に遠くて結構な渋滞があるし
A5: =ROW()-1 -> 4 | B5: 2023-01-02_14:11:36 | C5: 宮ヶ瀬のトイレ渋滞がヤバい。
A6: =ROW()-1 -> 5 | B6: 2022-12-28_16:33:22 | C6: それよりも帰りどうしようごてんばから丹沢まで下道orどうしみちor諦めて渋滞…