A1: No. | B1: ツイート時刻 | C1: ツイート内容
A2: =ROW()-1 -> 1 | B2: 2023-01-06_09:56:07 | C2: 現在(09:56)、首都圏の渋滞情報(3/4)です。・７号小松川線 上り 両国ＪＣＴ付近-渋滞:2km ・Ｋ１号横羽線 上り 浅田付近-混雑:1km 下り 浜川崎付近-混雑:1km ・小田原厚木道路 下り 大磯ＩＣ付近-渋… https://t.co/JorIizRJDU
A3: =ROW()-1 -> 2 | B3: 2023-01-05_12:56:07 | C3: 現在(12:56)、首都圏の渋滞情報(2/2)です。・小田原厚木道路 下り 大磯ＩＣ付近-渋滞:1km 上り 弁天山ＴＮ付近-渋滞:1km ・圏央道 内回 菅生ＴＮ付近-渋滞:7km #小田原厚木道路 #圏央道
A4: =ROW()-1 -> 3 | B4: 2023-01-05_11:56:07 | C4: 現在(11:56)、首都圏の渋滞情報(2/2)です。・中央環状線 内回 小菅ＪＣＴ付近-混雑:1km ・Ｋ７号横浜北線 下り 新横浜付近-混雑:1km ・小田原厚木道路 下り 大磯ＩＣ付近-渋滞:2km ・圏央道 内回 海… https://t.co/tOYKQjCS5i
A5: =ROW()-1 -> 4 | B5: 2023-01-05_10:56:07 | C5: 現在(10:56)、首都圏の渋滞情報(3/3)です。・小田原厚木道路 下り 大磯ＩＣ付近-渋滞:1km #小田原厚木道路
A6: =ROW()-1 -> 5 | B6: 2023-01-03_09:33:12 | C6: やべえ大磯で渋滞してやがる
A7: =ROW()-1 -> 6 | B7: 2023-01-02_17:55:41 | C7: 国道134号上り平塚市唐ヶ原〜西湘バイパス大磯港インター辺りまで断続渋滞。
A8: =ROW()-1 -> 7 | B8: 2023-01-02_10:52:14 | C8: 選手通過中の湘南新道とR134の上りの渋滞は駅伝を見たいからの渋滞？気持ちはわからなくないけど、迷惑になるのとこれで事故あったら、シャレにならないよ……あとは湘南新道と大磯〜二宮の国道1号の通過中道路横断も……
A9: =ROW()-1 -> 8 | B9: 2023-01-01_17:57:33 | C9: きたくーくー小田厚の大磯PA進入渋滞のとばっちりで大磯出口になかなか辿り着けないとか初めてでしたわ(;´д｀