A1: No. | B1: ツイート時刻 | C1: ツイート内容
A2: =ROW()-1 -> 1 | B2: 2023-01-06_18:54:37 | C2: 気持ちめっちゃわかるけど、それなら江ノ島線を全線高架化してほしい（）相模大野のオーバーパスと大和と藤沢のオーバーパスと全部レベル揃えて踏切無くなるから、そしたら全駅10両対応して輸送力大増強w
A3: =ROW()-1 -> 2 | B3: 2023-01-06_15:35:00 | C3: 大和市の「どこでもコミュニティ」の運営では、公定された情報や日常的な業務作業報告のようなものであれば、職員はコミュニティ上での発言に決裁を取る必要はなかった。職員がどう応えてよいかわからずに上司の判断を仰ぐ場合も、課長以上の決裁は必要としなかった。
A4: =ROW()-1 -> 3 | B4: 2023-01-04_00:42:54 | C4: 大和駅マーライオンだらけでホント治安悪すぎる
A5: =ROW()-1 -> 4 | B5: 2023-01-02_17:16:00 | C5: おださが〜イオン/南林間線も前に土日昼に乗ったらあまりに遅くて遅刻するかとヒヤヒヤした時がありましたし、この辺のイオン渋滞深刻ですよね(イオンモール座間からツイート)。え、団地北→台前駅で1時間掛か… https://t.co/ippq8KbcMn
A6: =ROW()-1 -> 5 | B6: 2023-01-01_12:53:49 | C6: @teng_sama 大和市が治安悪いみたいなイメージやめてください！！犯人は綾瀬市民！！綾瀬市の治安が悪い！！
A7: =ROW()-1 -> 6 | B7: 2023-01-01_03:27:47 | C7: 常日頃思うが大和市は治安がゴミすぎて笑える
A8: =ROW()-1 -> 7 | B8: 2023-01-01_02:46:15 | C8: 大和市の治安悪すぎんか…？
A9: =ROW()-1 -> 8 | B9: 2023-01-01_00:19:10 | C9: 【速報】神奈川・大和駅の付近で「腹を刺された人がいる」 被疑者と思われる男が確保 被害者の男性は搬送中（TBS NEWS DIG Powered by JNN） https://t.co/WWFTNl2MUC えー！夜の大和駅周辺治安悪いよね
A10: =ROW()-1 -> 9 | B10: 2022-12-31_10:17:56 | C10: @GreaterKanagawa 立地だけなら大和市。横浜近いし、町田にもすぐ侵攻できるし。治安はまぁ…
A11: =ROW()-1 -> 10 | B11: 2022-12-31_07:54:46 | C11: @SyuntaTiptoe @GreaterKanagawa 大和市はねぇ南の方は治安いいけど北側が、、、
A12: =ROW()-1 -> 11 | B12: 2022-12-31_04:34:46 | C12: @SyuntaTiptoe @GreaterKanagawa 大和市は場所によっては治安酷いw
A13: =ROW()-1 -> 12 | B13: 2022-12-30_21:54:47 | C13: @nonbeiyasu 大和市か・・外国人多い街だよな、確か・・本当に治安悪くなりますね・・
A14: =ROW()-1 -> 13 | B14: 2022-12-30_18:49:20 | C14: 大和トンネル過ぎてから渋滞から抜け出したと思ったら首都高の用賀から三軒茶屋まで渋滞。既に東京駅到着時間を40分は過ぎている
A15: =ROW()-1 -> 14 | B15: 2022-12-30_13:57:00 | C15: @sharenewsjapan1 大和市は治安悪いよ。外国人多い、ヤクザも多い、宗教多い。低所得の街。神奈川で事件も多い街。
A16: =ROW()-1 -> 15 | B16: 2022-12-28_13:56:08 | C16: 現在(13:56)、首都圏の渋滞情報(4/4)です。・Ｋ２号三ツ沢線 上り 横浜駅西口付近-渋滞:1km ・圏央道 内回 八王子城跡ＴＮ付近-渋滞:3km 外回 青梅ＴＮ入口付近-渋滞:4km ・東名 下り 大井松田ＩＣ付… https://t.co/WMzDktjE5n
A17: =ROW()-1 -> 16 | B17: 2022-12-28_02:50:24 | C17: 環七、一部の例外を除いて陸橋の名前で各地点が呼ばれてるイメージ 渋滞情報でも「大和陸橋から丸山陸橋まで2.0km」みたいな書き方をする（ちなみにこの例の場合だとたいてい先頭は大和陸橋の先にある高円寺駅の交差点）
A18: =ROW()-1 -> 17 | B18: 2022-12-28_01:09:02 | C18: @LHwIWezDUiP35x2 同じ海老名市でも厚木駅は何も無さすぎて、違う意味で夜は怖いです😱治安の悪さは大和市もかなり凄いみたいです。笑スーパーにバイクのまま入ってくる話とか、よく同期が話してました。笑
A19: =ROW()-1 -> 18 | B19: 2022-12-27_15:18:50 | C19: 今日は、5軒回りで残り大和市の巡回1軒です。が、藤沢から大和間は、距離もそこそこあり渋滞でウトウトしちゃうです(。-ω-)zzz. . . (。ﾟωﾟ) ﾊｯ!