A1: No. | B1: ツイート時刻 | C1: ツイート内容
A2: =ROW()-1 -> 1 | B2: 2023-01-05_19:47:29 | C2: パシフィコ横浜、横浜駅に寄せろなんて贅沢は言わないのでせめて桜木町駅にもう少し寄せるかみなとみらい駅直結くらいの位置にずらしてほしい
A3: =ROW()-1 -> 2 | B3: 2023-01-05_19:37:59 | C3: 横浜は治安悪い
A4: =ROW()-1 -> 3 | B4: 2023-01-05_19:16:11 | C4: ハマスタは関内以上に立地のいい場所がないから無理だろうけどあと数年で50年経過するし移設してほしいわねえ再開発の中に入れこめないのかしら
A5: =ROW()-1 -> 4 | B5: 2023-01-05_18:56:06 | C5: 現在(18:56)、首都圏の渋滞情報(2/2)です。・横浜横須賀道路 上り 狩場ＩＣ付近-渋滞:2km #横浜横須賀道路
A6: =ROW()-1 -> 5 | B6: 2023-01-05_18:56:06 | C6: 現在(18:56)、首都圏の渋滞情報(1/2)です。・３号渋谷線 下り 三軒茶屋付近-渋滞+混雑2km ・４号新宿線 下り 高井戸付近-混雑:2km 幡ヶ谷付近-混雑:2km ・高速湾岸線 西行 葛西ＪＣＴ付近-混雑:1k… https://t.co/rdHm08bBh8
A7: =ROW()-1 -> 6 | B7: 2023-01-05_18:30:16 | C7: ＃横浜市会 のネット中継で、議員席全体を映してほしいと要望をしたが、以前の時に「検討します」と言われた。今日、利害関係がある会に参加していることで問い合わせしたときに、再度聞いたら「検討してません」て！検討するて嘘を横浜市議会局は市民いいった。＃横浜市は嘘つきです
A8: =ROW()-1 -> 7 | B8: 2023-01-05_17:59:32 | C8: 全国で過去最多の感染県が多発しているのに全車両にノーマスクがいる横浜の電車。民度が最悪だ…。
A9: =ROW()-1 -> 8 | B9: 2023-01-05_17:56:08 | C9: 現在(17:56)、首都圏の渋滞情報(5/5)です。・圏央道 外回 上依知第一ＴＮ付近-渋滞:3km 圏央厚木ＩＣ付近-渋滞:6km ・東名 上り 綾瀬スマートＩＣ付近-渋滞:7km ・横浜横須賀道路 上り 狩場ＩＣ付近-渋滞:3km #圏央道 #東名 #横浜横須賀道路
A10: =ROW()-1 -> 9 | B10: 2023-01-05_16:56:08 | C10: 現在(16:56)、首都圏の渋滞情報(3/4)です。・圏央道 内回 久喜白岡ＪＣＴ・幸手ＩＣ間付近-渋滞:2km 外回 上依知第一ＴＮ付近-渋滞:3km 圏央厚木ＩＣ付近-渋滞:5km ・東名 上り 綾瀬スマートＩＣ付近-… https://t.co/mrErBg25Jj
A11: =ROW()-1 -> 10 | B11: 2023-01-05_15:58:13 | C11: @tomonathe 横浜新道から藤沢バイパスにかけてが一番渋滞するから、それのバイパスになるのありがたいっス。鎌倉は、どうせR134が混むから関係ないし、これができても湾岸線から横横通っていく分にはかわんないしね。
A12: =ROW()-1 -> 11 | B12: 2023-01-05_11:56:07 | C12: 現在(11:56)、首都圏の渋滞情報(2/2)です。・中央環状線 内回 小菅ＪＣＴ付近-混雑:1km ・Ｋ７号横浜北線 下り 新横浜付近-混雑:1km ・小田原厚木道路 下り 大磯ＩＣ付近-渋滞:2km ・圏央道 内回 海… https://t.co/tOYKQjCS5i
A13: =ROW()-1 -> 12 | B13: 2023-01-05_11:53:40 | C13: 富士から新横浜に変更…新車で16号走りたくないし新横浜めっちゃ狭い…😨しかも坂が急過ぎてトラックのAT登っていかない…😇最高から最悪かよ😩💦
A14: =ROW()-1 -> 13 | B14: 2023-01-05_10:54:50 | C14: 東京は子どもがいると月に5000円支給されるのか〜。横浜市もやってほしいな〜。なにしろ所得制限ばっかりで税金払っている人が恩恵を受けることができないシステムでやってきてる市だからね。やっと医療費の所得制限なくなるみたいだけど、絶対におかしいよ。
A15: =ROW()-1 -> 14 | B15: 2022-12-16_11:16:37 | C15: 電車だと新宿か八王子に出ないとならなくて、さすがに冬で大荷物だから初めて高速バスで行ってみる高速バスだと横浜から乗れるんだ…でも渋滞が…
A16: =ROW()-1 -> 15 | B16: 2022-12-16_10:56:09 | C16: 現在(10:56)、首都圏の渋滞情報(10/14)です。・Ｋ１号横羽線 上り 浅田付近-渋滞+混雑3km ・Ｋ７号横浜北線 上り 生麦ＪＣＴ付近-渋滞+混雑1km ・湾岸分岐線 西行 昭和島ＪＣＴ付近-渋滞:2km #Ｋ１号横羽線 #Ｋ７号横浜北線 #湾岸分岐線
A17: =ROW()-1 -> 16 | B17: 2022-12-16_10:36:21 | C17: 横浜駅で快特・特急乗車位置からエアポート急行羽田空港行に横入り（割り込み）乗車をする頭とマナーの悪いバ神奈川県民がいて、出勤前からイライラしている。#京急線
A18: =ROW()-1 -> 17 | B18: 2022-12-16_09:45:59 | C18: 鶴ヶ峰が「本当に住みやすい街10位」だって⁉️ウソウソ。タチ悪い酔っ払いは絡んでくるし、昼間っからお酒飲んだ年寄りが、頭から血ｨ🩸流して歩いてたりするし。相鉄-東急、JRが便利になるだけなのに。残念ながら、ガラ悪いよ〜〜#鶴ヶ峰#横浜市旭区#every
A19: =ROW()-1 -> 18 | B19: 2022-12-16_08:56:11 | C19: 現在(08:56)、首都圏の渋滞情報(13/14)です。・常磐道 下り 三郷ＴＮ付近-渋滞:12km ・東北道 下り 久喜白岡ＪＣＴ付近-渋滞:7km ・東名 上り 愛鷹ＰＡ・スマートＩＣ付近-渋滞:2km 岡津ＢＳ付近-… https://t.co/8BBe1Jck3m
A20: =ROW()-1 -> 19 | B20: 2022-12-16_08:56:10 | C20: 現在(08:56)、首都圏の渋滞情報(10/14)です。・Ｋ５号大黒線 下り 大黒ＪＣＴ付近-渋滞+混雑1km ・Ｋ７号横浜北西線 上り 横浜青葉ＪＣＴ付近-混雑:1km ・湾岸分岐線 西行 昭和島ＪＣＴ付近-渋滞+混雑1k… https://t.co/BCbXSa8flQ
A21: =ROW()-1 -> 20 | B21: 2022-12-16_08:30:59 | C21: 横浜付近にいくと電波悪くなるのほんとやめてほしい電波がんばってくれ、、
A22: =ROW()-1 -> 21 | B22: 2022-12-16_07:56:10 | C22: 現在(07:56)、首都圏の渋滞情報(15/15)です。・千葉東金道路 上り 千葉東ＪＣＴ付近-渋滞:1km ・横浜新道 上り 今井ＩＣ付近-渋滞:3km #千葉東金道路 #横浜新道
A23: =ROW()-1 -> 22 | B23: 2022-12-16_07:56:10 | C23: 現在(07:56)、首都圏の渋滞情報(14/15)です。・中央道 上り 烏山ＴＮ付近-渋滞:9km ・東名 上り 日進ＪＣＴ付近-渋滞:7km 愛鷹ＰＡ・スマートＩＣ付近-渋滞:4km 岡津ＢＳ付近-渋滞:2km 横浜青… https://t.co/Lq41AOZxs7
A24: =ROW()-1 -> 23 | B24: 2022-12-16_07:56:09 | C24: 現在(07:56)、首都圏の渋滞情報(9/15)です。・Ｋ７号横浜北線 上り 生麦ＪＣＴ付近-渋滞:1km ・湾岸分岐線 西行 昭和島ＪＣＴ付近-渋滞:1km #Ｋ７号横浜北線 #湾岸分岐線
A25: =ROW()-1 -> 24 | B25: 2022-12-16_06:56:10 | C25: 現在(06:56)、首都圏の渋滞情報(10/11)です。・東名 上り 日進ＢＳ付近-渋滞:2km 横浜青葉ＩＣ付近-渋滞:16km 下り 横浜町田ＩＣ付近-渋滞:4km ・常磐道 下り 三郷ＴＮ付近-渋滞:9km ・東関… https://t.co/544BGCaCzX
A26: =ROW()-1 -> 25 | B26: 2022-12-16_06:56:09 | C26: 現在(06:56)、首都圏の渋滞情報(7/11)です。・Ｋ５号大黒線 下り 大黒ＪＣＴ付近-渋滞+混雑1km ・Ｋ７号横浜北線 上り 生麦ＪＣＴ付近-渋滞+混雑1km #Ｋ５号大黒線 #Ｋ７号横浜北線
A27: =ROW()-1 -> 26 | B27: 2022-12-16_06:56:09 | C27: 現在(06:56)、首都圏の渋滞情報(5/11)です。・高速湾岸線 東行 横浜ベイブリッジ付近-渋滞:2km 大黒ＪＣＴ付近-渋滞+混雑2km 西行 東京港トンネル付近-混雑:1km 辰巳ＪＣＴ付近-混雑:5km 葛西付… https://t.co/BHJ2GPYEC7
A28: =ROW()-1 -> 27 | B28: 2022-12-16_06:46:00 | C28: 横浜線もしっかりダイヤ改正やってほしいなぁ具体的には「橋本・町田行き列車の行き先延長」「快速運転時刻短縮」くらいやってほしい
A29: =ROW()-1 -> 28 | B29: 2022-12-16_01:20:31 | C29: 渋滞情報です。東名高速は上り、横浜町田インター付近を走行中の警察車両を先頭に15キロ程度の渋滞。みんな追い抜くのが怖いみたいです
A30: =ROW()-1 -> 29 | B30: 2022-12-15_23:35:22 | C30: @mog_mog_oishiii 横浜町田あたりは時間によってはいつも渋滞してるけど上りだから下りほど混んでないと思う❕８ヶ月の頃に長距離移動したけど頻繁に休憩入れたから２時間くらい余計に掛かったよ〜😭💦夜出発ならいけるかもしれない( 'ω')و ̑
A31: =ROW()-1 -> 30 | B31: 2022-12-15_23:01:15 | C31: @loveyassy @vuyufQgCsnIimMu 「待機児童を「保留児童」と冷たい「ハマ弁」を給食と言い換える行政💢」「保留児童」「給食」など横浜市政は言葉の「言い換え」が目立ちますね。悪い事をする時に「言葉の言い換え」を人間はします。だまされてはいけませんね。
A32: =ROW()-1 -> 31 | B32: 2022-12-15_22:07:11 | C32: ふるさと納税、横浜市に払う住民税を減らし、地方にこの分を回せるのマジで良すぎるな。横浜みたいなサービス悪い自治体にはできるだけ税払いたくないもんな。
A33: =ROW()-1 -> 32 | B33: 2022-12-15_21:27:22 | C33: @akahata_PR 横浜の沿岸部の倉庫はエネオスの貯蓄庫で占められている学生時代から不満なのが横浜に貯蔵庫があるのに移送費のコストを抑え安くで提供できるはずなのになぜ関東のガソリンは高いのか？米軍は関税無しで生活必需品、食品、ガソリンを入れ放題なのも不満だ🐶
A34: =ROW()-1 -> 33 | B34: 2022-12-15_21:12:13 | C34: もう、横浜市長……ホラーすぎるなんでこんなに評判悪いのにゴリ押しなの。ワクワクじゃないよ。もうこわい
A35: =ROW()-1 -> 34 | B35: 2022-12-15_20:56:07 | C35: 現在(20:56)、首都圏の渋滞情報(1/2)です。・３号渋谷線 下り 三軒茶屋付近-混雑:2km ・圏央道 内回 愛川ＴＮ入口付近-渋滞:1km ・横浜横須賀道路 下り 逗子ＩＣ付近-渋滞:2km ・東北道 上り 蓮田Ｓ… https://t.co/TLesw1aNa1