A1: No. | B1: ツイート時刻 | C1: ツイート内容
A2: =ROW()-1 -> 1 | B2: 2023-01-01_15:06:17 | C2: 座間イオン渋滞アホ
A3: =ROW()-1 -> 2 | B3: 2022-12-31_19:03:21 | C3: 「孤独死①」69歳男性をひとり死させた｢個人情報｣という壁 ｢身寄りのない人間の最期｣とはこんなものか///孤独死の多発? 何故に?誰もが日々常ｺﾐﾆﾃｲの必要ありだが、孤独な人は苦手。私は座間市長に提言。立派庁舎は民の… https://t.co/Xks42kQFmj
A4: =ROW()-1 -> 3 | B4: 2022-12-31_16:35:57 | C4: 元々頻尿だからライブ終演後、トイレ使えないのきつくて。妊婦の時も何度かライブ行ったんだけど座間ってさ、駅遠いじゃん？あーーートイレ無理ぃって思ってたら奇跡的にホールのトイレが使えたんだよね、誰か共感してほしい😂
A5: =ROW()-1 -> 4 | B5: 2022-12-31_01:23:26 | C5: @a2ad_nh 私も座間案に同意です。（市ヶ谷地区に置くと「官邸主導感」も強いので。※語弊ありますけどツイートなのでご容赦）市ヶ谷もまぁまぁ近く、厚木は30分圏内、横田も１時間圏内（渋滞しなければ）なので、平時運用でも使いやすいと思います。
A6: =ROW()-1 -> 5 | B6: 2022-12-30_16:51:11 | C6: 座間イオン周辺渋滞しすぎやろ
A7: =ROW()-1 -> 6 | B7: 2022-12-30_15:14:40 | C7: @NenettyTkrmn 近くの物流センターで納品終わって出てきたらすごい渋滞だったんですよー。いまはもう別の場所にいるので、コストコ座間の状況はわからないです。
A8: =ROW()-1 -> 7 | B8: 2022-12-30_11:47:25 | C8: 座間のコストコ渋滞半端ない┐(´-｀)┌
A9: =ROW()-1 -> 8 | B9: 2022-12-26_17:16:16 | C9: 座間と川崎のコストコ周辺道路、コストコ渋滞パねぇ
A10: =ROW()-1 -> 9 | B10: 2022-12-24_23:18:51 | C10: @Nyajira0095 お疲れ様です🙇‍♂️唯一の救いは、コストコ座間店渋滞が無かったから、良かったでした😎
A11: =ROW()-1 -> 10 | B11: 2022-12-24_22:30:19 | C11: @yumin_0116x 座間ナプ前で渋滞中待ってたらスレッスレですり抜けしてったんで追っかけたらガン飛ばされてレブチン…w
A12: =ROW()-1 -> 11 | B12: 2022-12-24_17:30:52 | C12: 座間の走り納めをして、小田原へ移動しようとしたらやはり渋滞ぃぃ
A13: =ROW()-1 -> 12 | B13: 2022-12-24_12:14:10 | C13: @DC40_route293 座間はいつも通り悪いです笑
A14: =ROW()-1 -> 13 | B14: 2022-12-24_10:13:31 | C14: 今日も恒例のコストコ渋滞ですね。地元情報によると、もう朝9時ごろには渋滞が始まっていたようですね。#コストコ#座間#渋滞
A15: =ROW()-1 -> 14 | B15: 2022-12-24_09:47:28 | C15: おはようございます😃今日のコストコ座間周辺の渋滞はすごいです！お気をつけて❗️
A16: =ROW()-1 -> 15 | B16: 2022-12-23_22:52:31 | C16: 明日、明後日は246の座間、大和付近が渋滞凄そう(^◇^;)クリスマス渋滞だね🎄
A17: =ROW()-1 -> 16 | B17: 2022-12-23_18:09:00 | C17: 座間市渋滞酷くて10ｍごとにストップアンドゴーだからNAのルーミーで十分だし子育て世代には使いやすいんだと思う10年後はオタクが雪山で遊ぶ用に使う（）
A18: =ROW()-1 -> 17 | B18: 2022-12-15_10:51:21 | C18: 今朝は神奈川県座間市に宮城県大崎市から大型の荷台の半分ぐらいの看板積んでおろしてきたとこ⬅圏央道の八王子JCTで工事渋滞❔にハマった
A19: =ROW()-1 -> 18 | B19: 2022-12-14_08:10:31 | C19: 今日は、埼玉におじゃまします！！今座間の246号線ですが静岡と違ってめっちゃ渋滞してる(T . T)あと2時間半か
A20: =ROW()-1 -> 19 | B20: 2022-12-11_09:20:37 | C20: おはようございます😃今日もコストコ座間断続的に渋滞始まってます。お気をつけて❗️
A21: =ROW()-1 -> 20 | B21: 2022-12-10_09:17:08 | C21: おはようございます😃コストコ座間周辺渋滞始まってます。
A22: =ROW()-1 -> 21 | B22: 2022-12-09_16:39:06 | C22: @y_n_s_m_27 あるんですよ(≧▽≦)神奈川県座間市出来た時は厚木➡座間(10km程)コストコ渋滞で4時間掛かりました(どうでもいい事ですが)