A1: No. | B1: ツイート時刻 | C1: ツイート内容
A2: =ROW()-1 -> 1 | B2: 2023-01-04_07:55:50 | C2: 逗子の駅前のベンチと駐輪場、水道道で歩きタバコが多すぎ！危険だし、喘息なので歩きながら咳がでる！駐輪場に至っては、ローソン前の横断歩道に立った段階で煙かった！なんとかしてほしい！警察もいないし不安！
A3: =ROW()-1 -> 2 | B3: 2023-01-03_13:04:46 | C3: 国道134逗子方面鎌倉駅入口まで渋滞です。😓反対車線順調
A4: =ROW()-1 -> 3 | B4: 2023-01-02_12:56:07 | C4: 現在(12:56)、首都圏の渋滞情報(10/15)です。・中央道富士吉田線 下り 大月ＩＣ付近-渋滞:1km ・常磐道 下り 桜土浦ＩＣ付近-渋滞:1km 柏ＩＣ付近-渋滞:9km ・横浜横須賀道路 下り 逗子ＩＣ付近-渋… https://t.co/JC37isNWB7
A5: =ROW()-1 -> 4 | B5: 2023-01-02_11:56:10 | C5: 現在(11:56)、首都圏の渋滞情報(15/22)です。・横浜新道 下り 常盤台ＩＣ付近-渋滞:1km ・常磐道 下り 柏ＩＣ付近-渋滞:14km ・横浜横須賀道路 上り 新保土ヶ谷ＩＣ付近-渋滞:4km 下り 逗子ＩＣ付… https://t.co/9KH3YJudpy
A6: =ROW()-1 -> 5 | B6: 2023-01-01_19:01:13 | C6: 鎌倉逗子葉山はインフラが良くないけど平均所得は神奈川トップ３クラス おかねもちに見合った小さな車ってなかなかないのも現実 また狭いトコの処理は修行が必要ですからねぇ…どの辺で引っ込めばいいとかはやっぱり要修行なんでしょうね… 腰越人の妻を持つ逗子人として♪
A7: =ROW()-1 -> 6 | B7: 2023-01-01_17:18:42 | C7: 湘南、普通に蛮族のイメージなので鎌倉江ノ島逗子葉山入れないでほしい感ある()
A8: =ROW()-1 -> 7 | B8: 2023-01-01_13:04:13 | C8: ちなみに行きは江ノ島周辺初詣勢の渋滞にハマりました。諦めて高速乗ろうとしたら初詣交通規制で近くの高速は乗れませんでした(逗子インターまでお戻り)
A9: =ROW()-1 -> 8 | B9: 2022-12-31_22:05:09 | C9: @liaison_c そうなのですね…知りませんでした。逗子にちょこっと住んだ時に確かに電波が悪いのでケーブルテレビに入らないと〜と町内会の方に言われて入ってチャンネルNECOとか観てましたが…映らないのですね…それにしても高い‼️10万⁉️
A10: =ROW()-1 -> 9 | B10: 2022-12-31_17:47:09 | C10: 湘南新宿ライン止まってしまってる逗子行きなんとか早めに動き出してほしい
A11: =ROW()-1 -> 10 | B11: 2022-12-29_13:05:46 | C11: それにしても今日のOK渋滞は凄い。逗子駅前なぎさ通りの。